{"authority":{"decided_at":"2026-08-12T00:00:00Z","decided_by":"operator-semantic-authority","decision_id":"DEC-P3B-multi-instance-pilot","revision":1,"status":"approved"},"complexity":{"gold_blind":true,"proxy":{"extraction_rule":"len(instance[\"PRs\"]) then discard the count","name":"dataset_pr_record_count","source":"trusted fixed Arrow projection","source_fields":["complexity_stratum"]},"stratum_boundaries":[{"boundary_rule":"0-2 PR records","stratum":"low"},{"boundary_rule":"3-6 PR records","stratum":"medium"},{"boundary_rule":"7 or more PR records","stratum":"high"}]},"execution":{"model":"gpt-5.6-sol","per_instance_budget":{"max_total_tokens":1500000,"max_wall_time_seconds":1800},"reasoning_profile":"high"},"schema_version":"phase3_pilot_decisions.v1","selection":{"filters":{"excluded_instance_ids":["psf__requests_v2.27.0_v2.27.1"],"languages":[],"repositories":[],"required_tags":[]},"metadata_revision":"swe-evo-pr-count-r1","sample_size":3,"seed":20260812,"stratum_quotas":{"high":1,"low":1,"medium":1}},"thresholds":{"max_token_cost_ratio":2.0,"max_wall_time_cost_ratio":2.0,"non_inferiority_margin":0.1,"preselected_secondary_benefit_metric":"regressions"}}
